content	createDatetime	id	mine	modDateTimeJson	modDatetime	negativeCnt	positiveCnt	side	product	nickName	oauthType	createDatetime_dt
믹서기, 반죽기 등 주방가전을 제조하는 켄우드는 영국회사로 이 회사와 전혀 무관합니다. 	1563867395.0	663.0	False	2019-07-23 16:36	1563867395.0	0.0	0.0	0.0	켄우드	김윤후	kakao	2019-07-23 16:36:35
JVC 켄우드는 삼성 하만카돈의 JBL로 대체 가능합니다.	1563859370.0	589.0	False	2019-07-23 14:22	1563859370.0	0.0	0.0	0.0	켄우드	서도원	kakao	2019-07-23 14:22:50
JVC 켄우드(JVC Kenwood Corp., JVC)는 일본 요코하마에 본사를 둔 영국, 미국 및 중국 등에 지사를 갖고 있는 다국적 전자 회사이다. 태그에 주방가전 이라고 해야 할 듯 합니다. 믹서기 광고가 젤 먼저 검색하면 뜨는데요..... 	1563845669.0	443.0	False	2019-07-23 10:34	1563845669.0	0.0	0.0	0.0	켄우드	정원배	kakao	2019-07-23 10:34:29
삭제 되었습니다.	1563845552.0	438.0	False	2019-07-23 10:33	1563845588.0	0.0	0.0	0.0	켄우드	정원배	kakao	2019-07-23 10:32:32
공학용 계산기라면 TI(텍사스 인스트루먼트, 이름에서 볼 수 있듯이 미국 텍사스 기업)로 대체 가능합니다만, 카시오보다는 비싸다는 흠이 있습니다.	1564206096.0	2038.0	False	2019-07-27 14:41	1564206096.0	0.0	0.0	0.0	카시오	정다운/Milda/PET프로/HVT	kakao	2019-07-27 14:41:36
카시오, 샤프 공학계산기 대체품 이 뭐가있나요?	1564160650.0	1968.0	False	2019-07-27 02:04	1564160650.0	0.0	0.0	0.0	카시오	하하하	kakao	2019-07-27 02:04:10
순토 도 카시오제품입니다 순토 대체 상품은 가민이 있습니다	1564036022.0	1535.0	False	2019-07-25 15:27	1564036022.0	0.0	0.0	0.0	카시오	김희석(jangun)	kakao	2019-07-25 15:27:02
"헉. 계산기는 항상 카시오 썻는데.
회사 물품구매도 항상 카시오로 했는데 ㅠ_ㅠ 바꿔야겠네요."	1564014571.0	1413.0	False	2019-07-25 09:29	1564014571.0	0.0	0.0	0.0	카시오	이현주	kakao	2019-07-25 09:29:31
삭제 되었습니다.	1563886166.0	789.0	False	2019-07-23 21:51	1563886295.0	0.0	0.0	0.0	카시오	이정옥	kakao	2019-07-23 21:49:26
한국산업인력공단에 허용되는 공학용 계산기가 카시오랑 샤프인데 ㅠㅠ	1563881352.0	766.0	False	2019-07-23 20:29	1563881352.0	0.0	0.0	0.0	카시오	추여진	kakao	2019-07-23 20:29:12
피아노도 추가해주세요 전자피아노요~	1563850232.0	493.0	False	2019-07-23 11:50	1563850232.0	0.0	0.0	0.0	카시오	김태완	kakao	2019-07-23 11:50:32
"해리엇 이라는 국산 제품도 있네요..

https://harriotwatches.co.kr/"	1563836854.0	308.0	False	2019-07-23 08:07	1563836854.0	0.0	0.0	0.0	카시오	Virtusoo of Thrash	kakao	2019-07-23 08:07:34
카시오는 분류가 패션이 아닌 가전으로 가야	1563834927.0	292.0	False	2019-07-23 07:35	1563834927.0	0.0	0.0	0.0	카시오	吊兒郎當	kakao	2019-07-23 07:35:27
카시오는 돌핀시계로 대체 가능하지않나요~?	1563761206.0	118.0	False	2019-07-22 11:06	1563761206.0	0.0	0.0	0.0	카시오	트랜드메카	kakao	2019-07-22 11:06:46
DJ기기 중에서 파이오니아가 국내에서 가장 유명하다고 하던데, 유럽에서는 뉴막, 허큘리스, 트렉터 등의 브랜드도 많이 알려진 브랜드 입니다. 	1563948099.0	1127.0	False	2019-07-24 15:01	1563948099.0	0.0	0.0	0.0	파이오니아	이연재	kakao	2019-07-24 15:01:39
"얼마전까지 사용했었는데 부끄러워서 서랍에  봉인했음.  
이참에 시계사러  스위스 함 가까 ? ㅎㅎ 
"	1564363382.0	2276.0	False	2019-07-29 10:23	1564363382.0	0.0	0.0	0.0	지샥	정용섭(짜근앤젤)	kakao	2019-07-29 10:23:02
"지샥 견고함은 진짜 넘사급임;; 오토바이 타다가 바닥에 갈았는데도 갈리기만하고 멀쩡함 ㄷㄷㄷ
견고한 시계 솔직히 지샥 대체품이 있긴함?;; 군인들 입대시계로도 지샥만한게 없음 돌핀샀다가 1달썼나 훈련뛰고오니까 깨지던데;"	1564256622.0	2132.0	False	2019-07-28 04:43	1564256622.0	0.0	0.0	0.0	지샥	ChaN	kakao	2019-07-28 04:43:42
삭제 되었습니다.	1564256355.0	2130.0	False	2019-07-28 04:42	1564256551.0	0.0	0.0	0.0	지샥	ChaN	kakao	2019-07-28 04:39:15
시계서 무브먼트 방식가려내면 정말 얼마 안남을 거에요.순 쿼츠무브먼트나 스위스무브먼트가 좀더 정교한 측이라, 만들기 편한 재팬무브먼트쓰는데가 대부분이라서요.	1564150017.0	1939.0	False	2019-07-26 23:06	1564150017.0	0.0	0.0	0.0	지샥	송인혁	kakao	2019-07-26 23:06:57
"스포츠관련 시계 브랜드 가민(GARMIN) 도 추가해주세요 
"	1564134537.0	1876.0	False	2019-07-26 18:48	1564134537.0	0.0	0.0	0.0	지샥	황성호	kakao	2019-07-26 18:48:57
삭제 되었습니다.	1564122493.0	1829.0	False	2019-07-26 15:28	1564122497.0	0.0	0.0	0.0	지샥	LaDiosa	kakao	2019-07-26 15:28:13
시계는 역시 순토!! 오늘 새로 샀습니다.... 자랑입니다....ㅋㅋㅋㅋ	1563962436.0	1240.0	False	2019-07-24 19:00	1563962436.0	0.0	0.0	0.0	지샥	.-69981000	kakao	2019-07-24 19:00:36
카시오 제품라인이죠	1563961098.0	1223.0	False	2019-07-24 18:38	1563961098.0	0.0	0.0	0.0	지샥	.-69981000	kakao	2019-07-24 18:38:18
일제 무브먼트 쓰는 시계도 가리면 좋겠지만, 브랜드론 가려내기 힘드니 구매하시는 분들이 꼭 확인하시길...	1563952958.0	1165.0	False	2019-07-24 16:22	1563952958.0	0.0	0.0	0.0	지샥	최석주	kakao	2019-07-24 16:22:38
스위스 시계중에서도 알려지지 않고 그닥 비싸지않은 좋은 시계들 많습니다만 애플 워치가 답같긴하네요	1563859919.0	602.0	False	2019-07-23 14:31	1563859919.0	0.0	0.0	0.0	지샥	.-11961000	kakao	2019-07-23 14:31:59
PX에서도 파는게 현실	1563848101.0	473.0	False	2019-07-23 11:15	1563848101.0	0.0	0.0	0.0	지샥	FISHPUSH	kakao	2019-07-23 11:15:01
시계찰때 싸구려 저가나 초고가 시계를 제외한 시계들의 대부분 쿼츠가 일본산임. 시계도 애플워치 차고다니는게 맞음.	1563845565.0	439.0	False	2019-07-23 10:32	1563845565.0	0.0	0.0	0.0	지샥	정재용	kakao	2019-07-23 10:32:45
삭제 되었습니다.	1563841938.0	370.0	False	2019-07-23 09:33	1563842000.0	0.0	0.0	0.0	지샥	우정원	kakao	2019-07-23 09:32:18
"ㄷㄷ 군대가는데 필수였는데
일제였다니 아이러니하다"	1563841176.0	356.0	False	2019-07-23 09:19	1563841176.0	0.0	0.0	0.0	지샥	.-83881000	kakao	2019-07-23 09:19:36
뱅앤 올롭슨 추천...	1563962149.0	1237.0	False	2019-07-24 18:55	1563962149.0	0.0	0.0	0.0	JVC	.-69981000	kakao	2019-07-24 18:55:49
삼성 자회사인 하만카돈의 JBL, AKG 음향기기들 추천합니다.	1563859233.0	587.0	False	2019-07-23 14:20	1563859233.0	0.0	0.0	0.0	JVC	서도원	kakao	2019-07-23 14:20:33
삭제 되었습니다.	1563763509.0	122.0	False	2019-07-22 11:56	1563764180.0	0.0	0.0	0.0	JVC	하늘로	kakao	2019-07-22 11:45:09
블랙 이글스 찾아보니까 무브먼트가 일본꺼네요 빼셔야할듯	1564411601.0	2401.0	False	2019-07-29 23:46	1564411601.0	0.0	0.0	0.0	시티즌	sy kim	kakao	2019-07-29 23:46:41
그나마 저렴한 시계가 시티즌인데 거기다 에코 드라이브	1564031132.0	1511.0	False	2019-07-25 14:05	1564031132.0	0.0	0.0	0.0	시티즌	Dead Poets Society	kakao	2019-07-25 14:05:32
삭제 되었습니다.	1563936035.0	1017.0	False	2019-07-24 14:35	1563946528.0	0.0	0.0	0.0	시티즌	이종영	kakao	2019-07-24 11:40:35
세이코 가성비 좋은데 이미 샀으니 써야지	1564256199.0	2128.0	False	2019-07-28 04:36	1564256199.0	0.0	0.0	0.0	세이코	ChaN	kakao	2019-07-28 04:36:39
삭제 되었습니다.	1563952856.0	1164.0	False	2019-07-24 16:22	1563952974.0	0.0	0.0	0.0	세이코	최석주	kakao	2019-07-24 16:20:56
참고로, 세이코는 전범기업에 속합니다. 	1563887799.0	801.0	False	2019-07-23 22:16	1563887799.0	0.0	0.0	0.0	세이코	심형준	kakao	2019-07-23 22:16:39
'해리엇' 이라는 한국 브랜드도 있습니다. 대표적인 라인으로 서해 썬레이등이 있지요.	1563886587.0	790.0	False	2019-07-23 21:56	1563886587.0	0.0	0.0	0.0	세이코	심형준	kakao	2019-07-23 21:56:27
삭제 되었습니다.	1563845517.0	437.0	False	2019-07-23 10:32	1563845529.0	0.0	0.0	0.0	세이코	39	kakao	2019-07-23 10:31:57
"세이코 제가 등록신청한건데
지샥,세이코,시티즌 3개 신청했는데 시티즌은 안올려주셨어요 ㅜㅜ"	1563843848.0	406.0	False	2019-07-23 10:04	1563843848.0	0.0	0.0	0.0	세이코	김주연	kakao	2019-07-23 10:04:08
해리엇 이라는 국산 제품도 있네요.. https://harriotwatches.co.kr/	1563837013.0	310.0	False	2019-07-23 08:10	1563837013.0	0.0	0.0	0.0	세이코	Virtusoo of Thrash	kakao	2019-07-23 08:10:13
"박주혁//가격차이가 몇배나는거로 대체는 어렵고
티쏘 해밀턴 오리스 등으론 가능할듯
일본시계 기업에 시티즌도 추가해야"	1563823568.0	261.0	False	2019-07-23 04:26	1563823568.0	0.0	0.0	0.0	세이코	l******tro	kakao	2019-07-23 04:26:08
세이코 중저가 브렌드인 ALBA도 같이 표시해주면 좋겠습니다.	1563805072.0	204.0	False	2019-07-22 23:17	1563805072.0	0.0	0.0	0.0	세이코	안형영	kakao	2019-07-22 23:17:52
비싸지만 태그호이어로도 대체가능	1563771666.0	143.0	False	2019-07-22 14:01	1563771666.0	0.0	0.0	0.0	세이코	박주혁	kakao	2019-07-22 14:01:06
샤프의경우 대부분의 주요공장이 폭스콘으로 옮겨갔으며 샤프의 디스플레이 또한 같은그룹의 치메이 이노룩스에서 생산하는걸로 바뀌어서 일본회사라고하기는 애매합니다. 다만 샤프의 모회사인 홍하이그룹도 논란이 있긴합니다.	1564018125.0	1439.0	False	2019-07-25 10:28	1564018125.0	0.0	0.0	0.0	샤프	꼬르륵	kakao	2019-07-25 10:28:45
"샤프가 일본 기업은 맞는데, 모기업이 대만의 폭스콘입니다. 몇 년 전에 인수됐어요.
이제는 일본 회사라고 하기에도 약간 모호하긴 합니다.
태어나긴 일본에서 태어나서, 대만에 팔려간 이중국적 회사 정도?"	1563887096.0	795.0	False	2019-07-23 22:04	1563887096.0	0.0	0.0	0.0	샤프	김병록	kakao	2019-07-23 22:04:56
공기 청전기라고 되어 있어요. 공기청정기로 고쳐야 할 듯합니다.	1563877605.0	738.0	False	2019-07-23 19:26	1563877605.0	0.0	0.0	0.0	샤프	세아	kakao	2019-07-23 19:26:45
샤프는 대만이 아니라 일본의 종합 가전 기업이며, 일본 8대 가전제품 대기업입니다^^	1563869787.0	682.0	False	2019-07-23 17:16	1563869787.0	0.0	0.0	0.0	샤프	아직 이경희	kakao	2019-07-23 17:16:27
삭제 되었습니다.	1563869706.0	681.0	False	2019-07-23 17:15	1563869709.0	0.0	0.0	0.0	샤프	아직 이경희	kakao	2019-07-23 17:15:06
삭제 되었습니다.	1563869643.0	680.0	False	2019-07-23 17:14	1563869668.0	0.0	0.0	0.0	샤프	아직 이경희	kakao	2019-07-23 17:14:03
샤프 대만기업일껄요?	1563866151.0	659.0	False	2019-07-23 16:15	1563866151.0	0.0	0.0	0.0	샤프	ㄱ.S.Eun♥!	kakao	2019-07-23 16:15:51
당장 일본의존을 딱 끊어버릴 수 있는 상황이 아니고, 과도기를 통해 대체상품이나 준비되어 있는 기업들을 찾아 힘을 실어주고 한국 스스로 힘을 가질 수 있게 해보자는게 노노재팬 사이트의 근본인 걸로 알고 있습니다. 일본기술을 제공받아 기술제휴나 파트너쉽을 통한 연결고리가 문제는 단칼에 끊어낼 수 있는 문제들이 아닌건 누구나 알고 있고요. 계속 강조하면서 이야기하지만 불매운동으로 인해 국내기업들까지 타격을 입는건 좀 문제가 있는거 아닌가요?	1564412665.0	2406.0	False	2019-07-30 00:04	1564412665.0	0.0	0.0	0.0	코니카 미놀타	김경래	kakao	2019-07-30 00:04:25
그리고 신도같은 국내브랜드가 애초에 무리라는 식으로 말씀하셨는데, 그럼 어떤 국내브랜드 제품을 이용해야죠? 프린터사업부 hp에 매각시킨 삼성이요? 아님 일본인 대표자로 되어 있는 제록스? 캐논? 교세라? 엡손? 브라더? OKI? 코니카 미놀타? 불매운동의 본질이 뭔지 모르시나요? 그나마 국내 기술발전과 유통에 도움이 될 수 있는 발전가능성 있는 기업이 있는데도 이현령비현령거리면서 고집피울 이유가.. 김상진님 하는 행동이 여러모로 이해가 좀 안갑니다.	1564412098.0	2405.0	False	2019-07-29 23:54	1564412098.0	0.0	0.0	0.0	코니카 미놀타	김경래	kakao	2019-07-29 23:54:58
삼성은 2016년 하반기에 프린터사업부를 hp에 매각시킨건 알고 있는지요? 더군다나 신기종에 대한 기술개발도 진행되지 않고 있고요. 님이 그토록 싫어하는 신도는 그나마 일본기술을 토대로 미흡하지만 10년전?부터 자사기를 만들고 기술개발하고 있습니다. 일본의 광학기술을 흉내라도 내보려고 스캐너부에 들어가는 CCD라는 렌즈도 자체기술개발을 통해 CIS라는 렌즈기술도 반영한 걸로 알고요. 왜 그렇게 신도를 비난하는지 이유는 모르겠다만 좀 더 정확한 팩트로 반박해보시죠.	1564411666.0	2402.0	False	2019-07-29 23:47	1564411666.0	0.0	0.0	0.0	코니카 미놀타	김경래	kakao	2019-07-29 23:47:46
"삼성이 도시바 기술이라고요? 언제적 이야기를 하는건지 ㅋㅋㅋ 더 상세히 설명드리자면 삼성 MFP의 코스모스 계열과 폴라리스, MX3, MX4 복합기 원천기술은 미놀타입니다. 다만 삼성의 소프트웨어와 안드로이드 기반의 구성을 퓨전해서 운영되고 있고요. 
신도는 일본기술이고 삼성은 국내자체기술이라는 발언 자체가 말이 안되죠. 특히 스캐너쪽에 들어간 광학렌즈는 일본의 원천기술없이는 쉽지 않죠."	1564411327.0	2400.0	False	2019-07-29 23:42	1564411327.0	0.0	0.0	0.0	코니카 미놀타	김경래	kakao	2019-07-29 23:42:07
"알럽 신도요? ㅋㅋ 이런식으로 몰아가기 하면서 본인이 해석하기 편한대로 이야기하는 본인이 문제 있다고는 생각 안하세요? 
아래 댓글에서도 언급했듯이 저는 모든 브랜드를 유통하고 서비스하는 업종에 종사하고 있습니다. 
삼성복합기 SCET 1급 자격증과 5년 이상 관련 내용으로 전문기술을 가지고 있고요."	1564411050.0	2398.0	False	2019-07-29 23:37	1564411050.0	0.0	0.0	0.0	코니카 미놀타	김경래	kakao	2019-07-29 23:37:30
삭제 되었습니다.	1564410581.0	2396.0	False	2019-07-29 23:33	1564410831.0	0.0	0.0	0.0	코니카 미놀타	김경래	kakao	2019-07-29 23:29:41
그런 기준이라면 삼성이 대체품으로 말씀하시는게 맞지 않나요? 다 알다시피 삼성도 도시바 기반으로 개발 운영하다 자체개발하고 지금은 hp로 넘어갔으니 기타 브랜드본단 당근 일본제품영향력이 덜 미친  삼성제품이 더 대체제품으로 맞다 봅니다	1564397711.0	2381.0	False	2019-07-30 00:05	1564412719.0	0.0	0.0	0.0	코니카 미놀타	김상진	kakao	2019-07-29 19:55:11
"일단 흥분 가라앉히시고요 ㅎ
글을 잘 읽고 답 주시는게.. 첨부터 신도가 대체하기엔 무리가 있다고 말씀드렸잖아요
님께서 넘 편향되게 알럽 신도하시고  신도꺼면 대체가 가능한것처럼 말씀 하시고..
첨부터 말씀드렸듯이 대체하기엔  리코, 미놀타 제품이 많죠.  그랬더니 기술력,브랜드 파워 가지고 열 내시고..  "	1564397491.0	2380.0	False	2019-07-30 00:05	1564412720.0	1.0	0.0	0.0	코니카 미놀타	김상진	kakao	2019-07-29 19:51:31
캐논, 제록스, 엡손, 코니카미놀타, 교세라, OKI, 브라더 등... 일본불매운동에 포함된 제품들의 대표자와 수입구조에 대해서 정확하게 파악하고 반박을 하시죠. 그리고 현재 삼성의 MFP/프린터사업부가 어디에 종속되었는지도 확인하시고요. 그리고 삼성도 미놀타, 도시바기반의 기술로 MFP를 만든건 알고 계신가요? 관련내용에 대한 정확한 정보로 반박하신다면 언제든 답변드리겠습니다. 본인이 알고 있는 세상이 전부인 것처럼 이야기 하진 맙시다.	1564390049.0	2355.0	False	2019-07-29 17:57	1564390670.0	0.0	1.0	0.0	코니카 미놀타	김경래	kakao	2019-07-29 17:47:29
국내 100대기업중 일본과의 무역관계로 전혀 곤란하지 않은 기업이 몇이나 될까요? 이번 불매운동을 통해 일본의존도를 줄이고, 국내자가기술발전과 유통이 원활하게 하여 내실을 튼튼이 다져야 하는 과도기인데, 일본과의 무역관계에 있는 기업들까지 싸그리다 매장시킬 작정이신지요? 관련 내용에 대해 어설프게 아는 지식으로 전부를 알고 있는 것처럼 이야기하지 마십시오. 	1564389680.0	2353.0	False	2019-07-29 17:58	1564390683.0	0.0	1.0	0.0	코니카 미놀타	김경래	kakao	2019-07-29 17:41:20
100원 훔친도둑보다 70원 훔친도둑이 괜찮다고 안했습니다. 김상진님이 주장하는 논리로는 일본에 의존하는 기업은 다 불매하는게 맞다는 건데, 이번에 일본과 수출/수입문제로 제일 애먹는 곳이 어디죠? 원재료 공급차질로 제일 곤란한 곳이 삼성아닌가요? 그럼 삼성은 매국기업인 셈이네요? 일본에 돈벌어다주는 유통구조를 가지고 있는샘이니까요. 과잉일반화의 오류를 범고 국내기업들에 대한 흠잡기를 하는 건 좀 잘못된거 아닌가요? 	1564389479.0	2352.0	False	2019-07-29 17:37	1564389479.0	0.0	0.0	0.0	코니카 미놀타	김경래	kakao	2019-07-29 17:37:59
김상진님  삼성과 신도가 국내브랜드라는건 알고 계시지 않나요? 대표자도 내국인이고, 국내 사무기기 기업중 ODM기술을 가지고 있는 유일한 기업중 하나가 신도로 알고 있습니다. 브랜드파워 1위에서 기준이 모호하다고 비웃는데, 매년 시행하는 마켓쇼라는 건 아시나요? 애사심이요? 참고로 전 삼성, 캐논, 신도, HP제품을 유통하는 일에 종사중인데 국내브랜드에 대한 오해를 바로 잡기 위해 긴글 남겼는데  어설프게 아는 상식으로 비꼬기만 하시네요	1564389276.0	2351.0	False	2019-07-29 17:58	1564390681.0	0.0	0.0	0.0	코니카 미놀타	김경래	kakao	2019-07-29 17:34:36
"김경래님 전 단지 글쓴 내용에 대해 이야기 드린거에요 님  글 내용으로는 100원 훔친 도둑보다 난70원 밖에  안  훔쳤으니깐  괜찮다는 논리로 밖에 안 보여요^^ 그래서 대체로 신도리코는 무리라한거구요. 님께서  삼성이라고 했다면  반박 안합니다 ㅎ 넘치는 애사심으로 본질이 변질되면 안되겠죠  그리고 전체 매출에서 흑백 대 컬러  비교가 안되죠  계속 특정 제품만 말씀 하시길래요
브랜드파워 그냥 웃습니다  조사기관에따라 각 부문별 이름만 다르면서 1위한다고 제조사별로 엄청 홍보들하죠ㅎ 부문별 1위 아닌 기업을 찾기가 더 어렵죠 ㅎ"	1564325244.0	2244.0	False	2019-07-29 23:56	1564412164.0	1.0	0.0	0.0	코니카 미놀타	김상진	kakao	2019-07-28 23:47:24
https://blog.naver.com/wp2007/221594122485 제대로 된 품목과 내용 나열한 사이트 입니다. 여기서 물타기 하면서 일본기업 대체할 곳 없다, 한국기업은 기술이 없고 다 일본에 의존하고 있다는 개똥같은 발언하는 분들 이야기 듣지 말고 품목별로 잘 정리된 사이트도 참고해보세요.	1564239578.0	2113.0	False	2019-07-29 16:47	1564386420.0	0.0	1.0	0.0	코니카 미놀타	김경래	kakao	2019-07-27 23:59:38
홍아랑님 어디 근무하나요?? 캐논? 제록스? 일본기업에서 근무하는 건 확실한거 같고. 신도자체가 기술력이 없다? 혹시 님이 쓰신 댓글 캡쳐해서 신도에 제공해도 되는지요? 잘못된 정보를 마치 진실인것처럼 퍼트리면 분명 문제가 될텐데요. 제가 아래 상세히 설명드렸고 관련 비교내용까지 남겼는데, 이젠 기술력이 없다는 식으로 물타기 하는데. ‘2019 한국산업의 브랜드파워(K-BPI)’ 사무용복합기 부문에서 8년 연속 1위에 선정은 기술력이 없어도 가능한건가봐요?	1564202747.0	2033.0	False	2019-07-29 16:47	1564386421.0	0.0	1.0	0.0	코니카 미놀타	김경래	kakao	2019-07-27 13:45:47
신도가 자체 기술력 없습니다. 코니카미놀타 제품에 이름만 신도로 바꾸고, 복사기 앞커버 색깔바꾼게 다입니다. 신도가 위탁생산하는 흑백복사기의 도면은 일본 코니카미놀타가 제공합니다.	1564200429.0	2024.0	False	2019-07-27 13:07	1564200429.0	0.0	0.0	0.0	코니카 미놀타	홍아랑	kakao	2019-07-27 13:07:09
신도(Sindoh)는 ‘2019 한국산업의 브랜드파워(K-BPI)’ 사무용복합기 부문에서 8년 연속 1위에 선정되었고, 이번에 최초로 신설한 3D 프린터 부문에서도 1위를 차지했습니다. 이래도 대체상품이 될 수 없는건가요? 일본브랜드 제품은 5년동안 기술개발이든 제품인지도 부문에서 특별하게 얻은 성과가 있는지요?	1564196085.0	2009.0	False	2019-07-27 11:54	1564196085.0	0.0	0.0	0.0	코니카 미놀타	김경래	kakao	2019-07-27 11:54:45
"김상진님 혹시 일본제품관련 회사에서 PR하시는거 같네요? ODM제품이 소수라고요?? N500시리즈는 ODM제품인데 현재 흑백기 조달판매 시장에서 1위입니다. 
대체상품이 될 수 없다고 하셨는데, 일본제품 사용 꾸준히 하라는 말로 밖에 해석이 안되네요. 
광학기술이야 대체 불가라고 하지만, 분명 복사기 기술은 국내브랜드로는 SINDO(신도) 제품이 우세하다는 걸 알텐데요."	1564196012.0	2008.0	False	2019-07-27 11:53	1564196012.0	0.0	0.0	0.0	코니카 미놀타	김경래	kakao	2019-07-27 11:53:32
Mad nomad 님 신도리코는 이미 회사 CI에서 ricoh 때고 sindoh 로 바뀐지 오래 됬습니다. 잘 못알고 계신 정보 입니다 또한 국내 공공기관 얘기하셨는데 나라장터에 등재된 제품 중에 수입제품들은 제조사 앞에 OEM 표기를 다 하고 있습니다 잘 못알고 사는 경우를 방지하기 위해서요. 물론 신도 제품들 중 일부도 OEM 붙어 있습니다만 직접 생산 제품들도 많이 있습니다.  잘못된 정보를 쓰시면 안될것 같습니다. 	1564127608.0	1853.0	False	2019-07-29 17:58	1564390690.0	0.0	1.0	0.0	코니카 미놀타	최승영	kakao	2019-07-26 16:53:28
삭제 되었습니다.	1564124137.0	1837.0	False	2019-07-26 16:44	1564127070.0	0.0	0.0	0.0	코니카 미놀타	최승영	kakao	2019-07-26 15:55:37
신도리코는 이름에서도 아직도 일본 Ricoh를 버리지 못하고 있네요. 신도리코가 OEM, ODM을 하고 있다고 하지만, A3복합기의 주로 판매되는, 국내 매출의 많은 부분을 차지하는 제품은 코니카미놀타-KONICA MINOLTA에서 수입 판매하는 제품 으로 알고 있습니다. 공공기관들도 신도리코의 복사기 제품들을 국산 브랜드로 잘못알고 있는경우가 많죠. 판단은 구매자의 몫이나 정보는 바로 제공해야 할것 같습니다.	1564089455.0	1709.0	False	2019-07-29 17:58	1564390696.0	1.0	0.0	0.0	코니카 미놀타	Mad Nomad MK	kakao	2019-07-26 06:17:35
삭제 되었습니다.	1564041702.0	1587.0	False	2019-07-25 17:01	1564041708.0	0.0	0.0	0.0	코니카 미놀타	박선영	kakao	2019-07-25 17:01:42
"김경래 님
신도리코 OEM 제품도 있다고 하시고 ODM 제품만 나열해주시네요..
신도리코 제품 중 거의 대다수 제품 및 주력 상품이  OEM 제품이죠.. ODM제품은 소수며 잘 판매되지 않은 제품이구요..
신도리코가 대체 상품이 될 수 있다는 것은 무리가 있지 않나 싶습니다."	1564034118.0	1528.0	False	2019-07-25 14:55	1564034118.0	0.0	0.0	0.0	코니카 미놀타	김상진	kakao	2019-07-25 14:55:18
일본의 원천기술을 가져다 쓰느냐 아니냐도 중요하지만(일본의 원천기술을 이미 전세계적으로 광학기술의 점유가 엄청나서 거를 수가 없습니다), 매년 일본에 로열티 지불을 하느냐 마느냐가 더 중요한겁니다. 일본브랜드(캐논, 후지제록스, 교세라, OKI, 코니카미놀타 등)은 이미 엄청난 로열티를 지불해오고 있고, 국내 브랜드인 신도(Sindoh)와 삼성(Samsung)만 원천기술에 대한 특허관련비용만 지불하는 것만 알고 있습니다.	1564023870.0	1475.0	False	2019-07-29 17:58	1564390703.0	0.0	1.0	0.0	코니카 미놀타	김경래	kakao	2019-07-25 12:04:30
여기서 잘못 알고 계신분들이 많네요. 신도리코는 10여년전에 이미 신도(Sindoh)와 리코(rico)가 결별했습니다. OEM방식의 판매도 있지만, ODM(직접제조방식)의 판매와 생산을 한지 꽤 되었고요. 현재 ODM방식의 생산기기들이 D200,  D300, N610, N410, A401, A410, A420, N500  시리즈를 포함해 다양한 제품들이 주를 이루고 있습니다. 안병석님, 장동욱님 관련내용에 대해서 신도 본사에 직접 의뢰해보시죠.	1564023677.0	1474.0	False	2019-07-25 12:01	1564023677.0	0.0	0.0	0.0	코니카 미놀타	김경래	kakao	2019-07-25 12:01:17
대체상품이라 말하기 뭐하지만 미국 렉스마크사 프린터가 있긴 합니다. 그런데 어짜피 특허는 일본이....	1563974185.0	1297.0	False	2019-07-24 22:16	1563974185.0	0.0	0.0	0.0	코니카 미놀타	Design by soul	kakao	2019-07-24 22:16:25
"신도리코는 아래분이 설명하신대로
우리나라 신도교역와 일본 리코사와 기술제휴 합작회사입니다.
아직도 리코지분이 있구요.
